
    =========================== USB Port4 ===========================

Connection Status        : 0x01 (Device is connected)
Port Chain               : 3-4
Properties               : 0x01
 IsUserConnectable       : yes
 PortIsDebugCapable      : no
 PortHasMultiCompanions  : no
 PortConnectorIsTypeC    : no
ConnectionIndex          : 0x04 (Port 4)
CompanionIndex           : 0
 CompanionHubSymLnk      : USB#ROOT_HUB30#5&2c35141&0&0#{f18a0e88-c30c-11d0-8815-00a0c906bed8}
 CompanionPortNumber     : 0x08 (Port 8)
 -> CompanionPortChain   : 3-8

      ========================== Summary =========================
Vendor ID                : 0x046D (Logitech Inc.)
Product ID               : 0xC547
Manufacturer String      : Logitech
Product String           : USB Receiver
Serial                   : ---
USB Version              : 2.0 -> but Device is Full-Speed only
Port maximum Speed       : High-Speed (Companion Port 3-8 is doing the SuperSpeed)
Device maximum Speed     : Full-Speed
Device Connection Speed  : Full-Speed
Self powered             : no
Demanded Current         : 98 mA
Used Endpoints           : 4

      ======================== USB Device ========================

        +++++++++++++++++ Device Information ++++++++++++++++++
Device Description       : USB Composite Device
Device Path              : \\?\USB#VID_046D&PID_C547#6&c1a2e2f&0&4#{a5dcbf10-6530-11d2-901f-00c04fb951ed} (GUID_DEVINTERFACE_USB_DEVICE)
Kernel Name              : \Device\USBPDO-10
Device ID                : USB\VID_046D&PID_C547\6&C1A2E2F&0&4
Hardware IDs             : USB\VID_046D&PID_C547&REV_0402 USB\VID_046D&PID_C547
Driver KeyName           : {36fc9e60-c465-11cf-8056-444553540000}\0031 (GUID_DEVCLASS_USB)
Driver                   : \SystemRoot\System32\drivers\usbccgp.sys (Version: 10.0.19041.5794  Date: 2025-05-01  Company: Microsoft Corporation)
Driver Inf               : C:\Windows\inf\usb.inf
Legacy BusType           : PNPBus
Class                    : USB
Class GUID               : {36fc9e60-c465-11cf-8056-444553540000} (GUID_DEVCLASS_USB)
Service                  : usbccgp
Enumerator               : USB
Location Info            : Port_#0004.Hub_#0003
Address                  : 4
Location IDs             : PCIROOT(0)#PCI(0801)#PCI(0003)#USBROOT(0)#USB(4), ACPI(_SB_)#ACPI(PCI0)#ACPI(GP13)#ACPI(XHC0)#ACPI(RHUB)#ACPI(PRT4)
Container ID             : {30dcf1e5-31b0-11f0-888a-a85e451e3cda}
Manufacturer Info        : (Standard USB Host Controller)
Capabilities             : 0x84 (Removable, SurpriseRemovalOK)
Status                   : 0x0180600A (DN_DRIVER_LOADED, DN_STARTED, DN_DISABLEABLE, DN_REMOVABLE, DN_NT_ENUMERATOR, DN_NT_DRIVER)
Problem Code             : 0
Address                  : 4
EnhancedPowerMgmtEnabled : 0
Power State              : D0 (supported: D0, D1, D2, D3, wake from D0, wake from D1, wake from D2)

        +++++++++++++++++ Registry USB Flags +++++++++++++++++
HKEY_LOCAL_MACHINE\SYSTEM\CurrentControlSet\Control\usbflags\046DC5470402
 osvc                    : REG_BINARY 00 00
 NewInterfaceUsage       : REG_DWORD 00000000 (0)

        ---------------- Connection Information ---------------
Connection Index         : 0x04 (Port 4)
Connection Status        : 0x01 (DeviceConnected)
Current Config Value     : 0x01 (Configuration 1)
Device Address           : 0x03 (3)
Is Hub                   : 0x00 (no)
Device Bus Speed         : 0x01 (Full-Speed)
Number of open Pipes     : 0x03 (3 pipes to data endpoints)
Pipe[0]                  : EndpointID=1  Direction=IN   ScheduleOffset=0  Type=Interrupt  wMaxPacketSize=0x40    bInterval=1   -> 718 Bits/ms = 89750 Bytes/s
Pipe[1]                  : EndpointID=2  Direction=IN   ScheduleOffset=0  Type=Interrupt  wMaxPacketSize=0x40    bInterval=1   -> 718 Bits/ms = 89750 Bytes/s
Pipe[2]                  : EndpointID=3  Direction=IN   ScheduleOffset=0  Type=Interrupt  wMaxPacketSize=0x40    bInterval=1   -> 718 Bits/ms = 89750 Bytes/s
Data (HexDump)           : 04 00 00 00 12 01 00 02 00 00 00 40 6D 04 47 C5   ...........@m.G.
                           02 04 01 02 00 01 01 01 00 03 00 03 00 00 00 01   ................
                           00 00 00 07 05 81 03 40 00 01 00 00 00 00 07 05   .......@........
                           82 03 40 00 01 00 00 00 00 07 05 83 03 40 00 01   ..@..........@..
                           00 00 00 00                                       ....

        --------------- Connection Information V2 -------------
Connection Index         : 0x04 (4)
Length                   : 0x10 (16 bytes)
SupportedUsbProtocols    : 0x03
 Usb110                  : 1 (yes, port supports USB 1.1)
 Usb200                  : 1 (yes, port supports USB 2.0)
 Usb300                  : 0 (no, port not supports USB 3.0) -> but Companion Port 3-8 does
 ReservedMBZ             : 0x00
Flags                    : 0x00
 DevIsOpAtSsOrHigher     : 0 (Device is not operating at SuperSpeed or higher)
 DevIsSsCapOrHigher      : 0 (Device is not SuperSpeed capable or higher)
 DevIsOpAtSsPlusOrHigher : 0 (Device is not operating at SuperSpeedPlus or higher)
 DevIsSsPlusCapOrHigher  : 0 (Device is not SuperSpeedPlus capable or higher)
 ReservedMBZ             : 0x00
Data (HexDump)           : 04 00 00 00 10 00 00 00 03 00 00 00 00 00 00 00   ................

    ---------------------- Device Descriptor ----------------------
bLength                  : 0x12 (18 bytes)
bDescriptorType          : 0x01 (Device Descriptor)
bcdUSB                   : 0x200 (USB Version 2.0) -> but device is Full-Speed only
bDeviceClass             : 0x00 (defined by the interface descriptors)
bDeviceSubClass          : 0x00
bDeviceProtocol          : 0x00
bMaxPacketSize0          : 0x40 (64 bytes)
idVendor                 : 0x046D (Logitech Inc.)
idProduct                : 0xC547
bcdDevice                : 0x0402
iManufacturer            : 0x01 (String Descriptor 1)
 Language 0x0409         : "Logitech"
iProduct                 : 0x02 (String Descriptor 2)
 Language 0x0409         : "USB Receiver"
iSerialNumber            : 0x00 (No String Descriptor)
bNumConfigurations       : 0x01 (1 Configuration)
Data (HexDump)           : 12 01 00 02 00 00 00 40 6D 04 47 C5 02 04 01 02   .......@m.G.....
                           00 01                                             ..

    ------------------ Configuration Descriptor -------------------
bLength                  : 0x09 (9 bytes)
bDescriptorType          : 0x02 (Configuration Descriptor)
wTotalLength             : 0x0054 (84 bytes)
bNumInterfaces           : 0x03 (3 Interfaces)
bConfigurationValue      : 0x01 (Configuration 1)
iConfiguration           : 0x04 (String Descriptor 4)
 Language 0x0409         : "MPR04.02_B0009"
bmAttributes             : 0xA0
 D7: Reserved, set 1     : 0x01
 D6: Self Powered        : 0x00 (no)
 D5: Remote Wakeup       : 0x01 (yes)
 D4..0: Reserved, set 0  : 0x00
MaxPower                 : 0x31 (98 mA)
Data (HexDump)           : 09 02 54 00 03 01 04 A0 31 09 04 00 00 01 03 01   ..T.....1.......
                           02 00 09 21 11 01 00 01 22 53 00 07 05 81 03 40   ...!...."S.....@
                           00 01 09 04 01 00 01 03 01 01 00 09 21 11 01 00   ............!...
                           01 22 85 00 07 05 82 03 40 00 01 09 04 02 00 01   ."......@.......
                           03 00 00 00 09 21 11 01 00 01 22 36 00 07 05 83   .....!...."6....
                           03 40 00 01                                       .@..

        ---------------- Interface Descriptor -----------------
bLength                  : 0x09 (9 bytes)
bDescriptorType          : 0x04 (Interface Descriptor)
bInterfaceNumber         : 0x00 (Interface 0)
bAlternateSetting        : 0x00
bNumEndpoints            : 0x01 (1 Endpoint)
bInterfaceClass          : 0x03 (HID - Human Interface Device)
bInterfaceSubClass       : 0x01 (Boot Interface)
bInterfaceProtocol       : 0x02 (Mouse)
iInterface               : 0x00 (No String Descriptor)
Data (HexDump)           : 09 04 00 00 01 03 01 02 00                        .........

        ------------------- HID Descriptor --------------------
bLength                  : 0x09 (9 bytes)
bDescriptorType          : 0x21 (HID Descriptor)
bcdHID                   : 0x0111 (HID Version 1.11)
bCountryCode             : 0x00 (00 = not localized)
bNumDescriptors          : 0x01
Data (HexDump)           : 09 21 11 01 00 01 22 53 00                        .!...."S.
Descriptor 1:
bDescriptorType          : 0x22 (Class=Report)
wDescriptorLength        : 0x0053 (83 bytes)
Error reading descriptor : ERROR_GEN_FAILURE (due to a obscure limitation of the Win32 USB API, see F1 Help)

        ----------------- Endpoint Descriptor -----------------
bLength                  : 0x07 (7 bytes)
bDescriptorType          : 0x05 (Endpoint Descriptor)
bEndpointAddress         : 0x81 (Direction=IN EndpointID=1)
bmAttributes             : 0x03 (TransferType=Interrupt)
wMaxPacketSize           : 0x0040 (64 bytes)
bInterval                : 0x01 (1 ms)
Data (HexDump)           : 07 05 81 03 40 00 01                              ....@..

        ---------------- Interface Descriptor -----------------
bLength                  : 0x09 (9 bytes)
bDescriptorType          : 0x04 (Interface Descriptor)
bInterfaceNumber         : 0x01 (Interface 1)
bAlternateSetting        : 0x00
bNumEndpoints            : 0x01 (1 Endpoint)
bInterfaceClass          : 0x03 (HID - Human Interface Device)
bInterfaceSubClass       : 0x01 (Boot Interface)
bInterfaceProtocol       : 0x01 (Keyboard)
iInterface               : 0x00 (No String Descriptor)
Data (HexDump)           : 09 04 01 00 01 03 01 01 00                        .........

        ------------------- HID Descriptor --------------------
bLength                  : 0x09 (9 bytes)
bDescriptorType          : 0x21 (HID Descriptor)
bcdHID                   : 0x0111 (HID Version 1.11)
bCountryCode             : 0x00 (00 = not localized)
bNumDescriptors          : 0x01
Data (HexDump)           : 09 21 11 01 00 01 22 85 00                        .!...."..
Descriptor 1:
bDescriptorType          : 0x22 (Class=Report)
wDescriptorLength        : 0x0085 (133 bytes)
Error reading descriptor : ERROR_GEN_FAILURE (due to a obscure limitation of the Win32 USB API, see F1 Help)

        ----------------- Endpoint Descriptor -----------------
bLength                  : 0x07 (7 bytes)
bDescriptorType          : 0x05 (Endpoint Descriptor)
bEndpointAddress         : 0x82 (Direction=IN EndpointID=2)
bmAttributes             : 0x03 (TransferType=Interrupt)
wMaxPacketSize           : 0x0040 (64 bytes)
bInterval                : 0x01 (1 ms)
Data (HexDump)           : 07 05 82 03 40 00 01                              ....@..

        ---------------- Interface Descriptor -----------------
bLength                  : 0x09 (9 bytes)
bDescriptorType          : 0x04 (Interface Descriptor)
bInterfaceNumber         : 0x02 (Interface 2)
bAlternateSetting        : 0x00
bNumEndpoints            : 0x01 (1 Endpoint)
bInterfaceClass          : 0x03 (HID - Human Interface Device)
bInterfaceSubClass       : 0x00 (None)
bInterfaceProtocol       : 0x00 (None)
iInterface               : 0x00 (No String Descriptor)
Data (HexDump)           : 09 04 02 00 01 03 00 00 00                        .........

        ------------------- HID Descriptor --------------------
bLength                  : 0x09 (9 bytes)
bDescriptorType          : 0x21 (HID Descriptor)
bcdHID                   : 0x0111 (HID Version 1.11)
bCountryCode             : 0x00 (00 = not localized)
bNumDescriptors          : 0x01
Data (HexDump)           : 09 21 11 01 00 01 22 36 00                        .!...."6.
Descriptor 1:
bDescriptorType          : 0x22 (Class=Report)
wDescriptorLength        : 0x0036 (54 bytes)
Error reading descriptor : ERROR_GEN_FAILURE (due to a obscure limitation of the Win32 USB API, see F1 Help)

        ----------------- Endpoint Descriptor -----------------
bLength                  : 0x07 (7 bytes)
bDescriptorType          : 0x05 (Endpoint Descriptor)
bEndpointAddress         : 0x83 (Direction=IN EndpointID=3)
bmAttributes             : 0x03 (TransferType=Interrupt)
wMaxPacketSize           : 0x0040 (64 bytes)
bInterval                : 0x01 (1 ms)
Data (HexDump)           : 07 05 83 03 40 00 01                              ....@..

    ----------------- Device Qualifier Descriptor -----------------
Error                    : ERROR_GEN_FAILURE  (because the device is Full-Speed only)

      -------------------- String Descriptors -------------------
             ------ String Descriptor 0 ------
bLength                  : 0x04 (4 bytes)
bDescriptorType          : 0x03 (String Descriptor)
Language ID[0]           : 0x0409 (English - United States)
Data (HexDump)           : 04 03 09 04                                       ....
             ------ String Descriptor 1 ------
bLength                  : 0x12 (18 bytes)
bDescriptorType          : 0x03 (String Descriptor)
Language 0x0409          : "Logitech"
Data (HexDump)           : 12 03 4C 00 6F 00 67 00 69 00 74 00 65 00 63 00   ..L.o.g.i.t.e.c.
                           68 00                                             h.
             ------ String Descriptor 2 ------
bLength                  : 0x1A (26 bytes)
bDescriptorType          : 0x03 (String Descriptor)
Language 0x0409          : "USB Receiver"
Data (HexDump)           : 1A 03 55 00 53 00 42 00 20 00 52 00 65 00 63 00   ..U.S.B. .R.e.c.
                           65 00 69 00 76 00 65 00 72 00                     e.i.v.e.r.
             ------ String Descriptor 4 ------
bLength                  : 0x1E (30 bytes)
bDescriptorType          : 0x03 (String Descriptor)
Language 0x0409          : "MPR04.02_B0009"
Data (HexDump)           : 1E 03 4D 00 50 00 52 00 30 00 34 00 2E 00 30 00   ..M.P.R.0.4...0.
                           32 00 5F 00 42 00 30 00 30 00 30 00 39 00         2._.B.0.0.0.9.
